{
  "id": "01K6B3P2A9QRSTVWXYZ0123457",
  "reviewId": "01K6B3A1B2C3D4E5F6G7H8J9KM",
  "repositoryId": "01K6B2Z0R3P0S1T2V3W4X5Y6Z7",
  "status": "in_progress",
  "awaiting": "agent",
  "resolution": null,
  "closed": false,
  "anchor": {
    "kind": "range",
    "path": "src/Billing/InvoiceTotals.php",
    "commitSha": "79f8595a4c1e2b3d5f6071829a3b4c5d6e7f8091",
    "blobSha": "3b18e512dba79e4c8300dd08aeb37f8e728b8dad",
    "range": {
      "startLine": 52,
      "endLine": 58
    },
    "symbol": null,
    "snapshot": {
      "lines": ["    {", "        $tax = $this->total() * $this->taxRate;", "        $cents = $tax * 100;", "        $rounded = round($cents, 0, PHP_ROUND_HALF_EVEN);", "", "        return $rounded / 100;", "    }"],
      "truncated": false,
      "lineCount": 7,
      "before": ["    }", "", "    public function tax(): float"],
      "after": ["", "    public function lines(): array", "    {"],
      "normalizedHash": "sha256:09938bff856dc45843179cd6426abee27580709e3ea2c414914ed5915d64787c"
    }
  },
  "summary": "Extract the tax rounding into `TaxRounding`.",
  "author": {
    "kind": "user",
    "userId": "01K6AZZ9Y8X7W6V5T4S3R2Q1P0",
    "agentName": null,
    "name": "janklan",
    "avatarUrl": "https://avatars.githubusercontent.com/u/1?v=4"
  },
  "claimedBy": {
    "kind": "agent",
    "userId": "01K6AZZ9Y8X7W6V5T4S3R2Q1P0",
    "agentName": "claude-code laptop",
    "name": "claude-code laptop",
    "avatarUrl": null
  },
  "claimedAt": "2026-09-29T07:41:00Z",
  "commentCount": 1,
  "commitCount": 0,
  "pendingCommitCount": 0,
  "outdated": false,
  "createdAt": "2026-09-29T07:10:00Z",
  "updatedAt": "2026-09-29T07:41:00Z",
  "lastEventSeq": 1841,
  "carriedFrom": null,
  "requireApproval": false,
  "proposal": null,
  "body": "Extract the tax rounding into `TaxRounding`.",
  "reviewState": "open",
  "reviewCommitSha": "79f8595a4c1e2b3d5f6071829a3b4c5d6e7f8091",
  "location": {
    "target": "default_branch",
    "targetSha": "79f8595a4c1e2b3d5f6071829a3b4c5d6e7f8091",
    "status": "exact",
    "path": "src/Billing/InvoiceTotals.php",
    "range": {
      "startLine": 52,
      "endLine": 58
    },
    "confidence": 1,
    "reason": null
  },
  "excerpt": {
    "targetSha": "79f8595a4c1e2b3d5f6071829a3b4c5d6e7f8091",
    "path": "src/Billing/InvoiceTotals.php",
    "startLine": 50,
    "endLine": 60,
    "lines": ["", "    public function tax(): float", "    {", "        $tax = $this->total() * $this->taxRate;", "        $cents = $tax * 100;", "        $rounded = round($cents, 0, PHP_ROUND_HALF_EVEN);", "", "        return $rounded / 100;", "    }", "", "    public function lines(): array"],
    "truncated": false
  },
  "thread": [
    {
      "seq": 1810,
      "eventId": "01K6C2EVT00000000000001810",
      "type": "request.opened",
      "actor": {
        "kind": "user",
        "userId": "01K6AZZ9Y8X7W6V5T4S3R2Q1P0",
        "agentName": null,
        "name": "janklan",
        "avatarUrl": "https://avatars.githubusercontent.com/u/1?v=4"
      },
      "occurredAt": "2026-09-29T07:10:00Z",
      "body": "Extract the tax rounding into `TaxRounding`.",
      "diff": null,
      "commentId": null,
      "question": false,
      "batchId": null,
      "commitSha": null,
      "pullRequestUrl": null,
      "statusAfter": "open"
    },
    {
      "seq": 1831,
      "eventId": "01K6C2EVT00000000000001831",
      "type": "request.commented",
      "actor": {
        "kind": "user",
        "userId": "01K6AZZ9Y8X7W6V5T4S3R2Q1P0",
        "agentName": null,
        "name": "janklan",
        "avatarUrl": "https://avatars.githubusercontent.com/u/1?v=4"
      },
      "occurredAt": "2026-09-29T07:20:00Z",
      "body": "Keep the rounding mode configurable.",
      "diff": null,
      "commentId": "01K6C3C0MMENT0000000000001",
      "question": false,
      "batchId": "01K6B3P1Z8Y7X6W5V4T3S2R1Q0",
      "commitSha": null,
      "pullRequestUrl": null,
      "statusAfter": "open"
    },
    {
      "seq": 1841,
      "eventId": "01K6C2EVT00000000000001841",
      "type": "request.claimed",
      "actor": {
        "kind": "agent",
        "userId": "01K6AZZ9Y8X7W6V5T4S3R2Q1P0",
        "agentName": "claude-code laptop",
        "name": "claude-code laptop",
        "avatarUrl": null
      },
      "occurredAt": "2026-09-29T07:41:00Z",
      "body": null,
      "diff": null,
      "commentId": null,
      "question": false,
      "batchId": null,
      "commitSha": null,
      "pullRequestUrl": null,
      "statusAfter": "in_progress"
    }
  ],
  "commits": [],
  "pullRequestUrls": [],
  "pullRequests": [],
  "allowedActions": ["reply", "release", "link_commits", "link_pull_request", "mark_ready_for_review", "mark_wont_do", "propose_solution"]
}
